{
  "$schema": "https://raw.githubusercontent.com/imbilawork/know.agent/main/agentapi/schema/explainer-v1.json",
  "meta": {
    "id": "liteparse",
    "title": "LiteParse Explained",
    "subtitle": "Fast, local document parsing for AI agents",
    "topic": "LiteParse",
    "category": "framework",
    "tags": ["document-parsing", "local-first", "open-source", "typescript", "ocr", "spatial-text", "ai-agents", "llamaindex"],
    "published": "2026-03",
    "validated": "2026-03",
    "author": "Imbila.AI",
    "canonical_url": "https://know.imbila.ai/liteparse-explainer",
    "license": "CC-BY-SA-4.0"
  },
  "summary": "LiteParse is an open-source document parsing library by LlamaIndex that extracts text from PDFs, Office documents, and images while preserving spatial layout. It runs entirely locally with no cloud calls, no API keys, and no LLMs involved in parsing. TypeScript-native with built-in OCR via Tesseract.js, it is designed specifically for AI agent workflows that need fast, reliable document reading.",
  "key_stats": [
    { "value": "0", "label": "Python Dependencies" },
    { "value": "0", "label": "API Keys Required" },
    { "value": "2.8k+", "label": "GitHub Stars (First 2 Weeks)" },
    { "value": "50+", "label": "Supported File Formats" }
  ],
  "products": [
    {
      "name": "Spatial Text Parsing",
      "role": "Core parsing engine",
      "description": "Projects text onto a spatial grid using whitespace and indentation to preserve original page layout. Instead of converting tables and columns to Markdown (which breaks constantly), it keeps spatial relationships intact and lets the LLM interpret what it sees.",
      "pricing": null
    },
    {
      "name": "Bounding Boxes",
      "role": "Coordinate metadata",
      "description": "Every line of extracted text includes precise coordinate data — where it sat on the page, how wide it was. Useful for downstream processing, visualization, or building region-specific extraction pipelines.",
      "pricing": null
    },
    {
      "name": "Built-in OCR",
      "role": "Scanned document handling",
      "description": "Scanned PDFs and images are handled automatically via Tesseract.js. OCR parallelises across CPU cores by default (num_workers = cores - 1). Supports plugging in external OCR servers (PaddleOCR, EasyOCR) for higher accuracy on difficult documents.",
      "pricing": null
    },
    {
      "name": "Multimodal Screenshots",
      "role": "Visual fallback for agents",
      "description": "Generates page-level screenshots alongside text output. Enables a two-step agent pattern: parse text for fast understanding, fall back to screenshots when the agent needs to visually inspect charts, diagrams, or complex formatting.",
      "pricing": null
    }
  ],
  "ecosystem": {
    "local_parsing": {
      "product": "LiteParse",
      "description": "Open-source, local-first. Spatial text + bounding boxes + screenshots. Fast, simple, no cloud. Best for agents and real-time pipelines where speed matters more than perfect structure detection."
    },
    "cloud_parsing": {
      "product": "LlamaParse",
      "description": "Paid cloud service with proprietary models. Agentic OCR, structured outputs (Markdown, JSON schemas), premium accuracy on dense tables, charts, and handwritten text. Built for production document intelligence."
    },
    "framework": {
      "product": "LlamaIndex",
      "description": "The broader Python/TS framework for building LLM applications. LiteParse slots in as the document loading stage — a drop-in component for VectorStoreIndex and IngestionPipeline workflows."
    }
  },
  "decision_guide": {
    "use_when": [
      "You're building AI agents that need to read documents quickly and move on. Speed matters more than perfect structural conversion.",
      "You want local-first execution. Your documents are sensitive, your environment is air-gapped, or you simply don't want to pay for cloud parsing on straightforward documents.",
      "Your stack is JavaScript/TypeScript. LiteParse is native to this environment — no Python runtime overhead, installs via npm in seconds.",
      "You need a two-step parse-then-screenshot workflow. LiteParse was built around exactly this agent pattern: fast text first, visual fallback second."
    ],
    "skip_when": [
      "Your documents have dense, complex tables with merged cells, multi-level headers, or columns that don't snap to a clean grid. Spatial parsing alone won't resolve these reliably.",
      "You need structured output — Markdown tables, JSON schemas, strict key-value extraction. LiteParse outputs spatial text and bounding boxes. That's it.",
      "You're processing handwritten text or heavily degraded scans. Built-in Tesseract.js is decent for standard scans but isn't state-of-the-art OCR. You'll want LlamaParse or a dedicated OCR model.",
      "You need chart or diagram parsing — extracting data from visual elements. This requires multimodal LLM reasoning on screenshots, which LiteParse can enable but doesn't do itself."
    ]
  },
  "use_cases": [
    {
      "category": "Agent Tooling",
      "title": "Two-Step Document Reading",
      "description": "Agents parse text first for fast understanding, then generate page screenshots for visual follow-up on charts or complex layouts. LiteParse ships as an agent skill for this exact pattern."
    },
    {
      "category": "RAG Pipelines",
      "title": "Local Document Ingestion",
      "description": "Feed documents into a vector store without cloud round-trips. LiteParse handles the parsing stage of RAG pipelines where latency and privacy matter — internal docs, legal files, financial reports."
    },
    {
      "category": "Dev Tooling",
      "title": "CLI Document Processing",
      "description": "Pipe remote PDFs directly through LiteParse from the command line. Batch-parse entire directories. Integrate into CI/CD or automation scripts without standing up a service."
    },
    {
      "category": "Enterprise",
      "title": "Air-Gapped Environments",
      "description": "Regulated industries (finance, healthcare, government) where documents cannot leave the network. LiteParse runs fully offline with no external calls — OCR included."
    },
    {
      "category": "Multimodal AI",
      "title": "Text + Vision Workflows",
      "description": "Combine spatial text extraction with page screenshots. Feed both into multimodal models for richer document understanding — particularly useful for reports with embedded charts and diagrams."
    },
    {
      "category": "Edge & Embedded",
      "title": "Browser & Edge Parsing",
      "description": "TypeScript-native means LiteParse fits into web-based and edge-computing environments without a Python runtime. Parse documents closer to the user, closer to the data."
    }
  ],
  "timeline": [
    { "date": "2022", "title": "LlamaIndex Launches", "detail": "Originally called GPT Index, the framework establishes itself as the go-to toolkit for connecting LLMs to external data sources. Document loading is a core concern from day one." },
    { "date": "2024", "title": "LlamaParse Goes to Production", "detail": "LlamaIndex launches LlamaParse as a managed cloud parsing service. Agentic OCR, structured outputs, and premium accuracy — built specifically for enterprise document intelligence pipelines." },
    { "date": "2026-03", "title": "LiteParse Open-Sourced", "detail": "LlamaIndex extracts the lightweight, fast-mode core of LlamaParse's parsing engine and releases it as LiteParse — standalone open-source under Apache-2.0. TypeScript-native, zero cloud dependencies, designed for AI agents." },
    { "date": "2026-03", "title": "2.8k GitHub Stars in Two Weeks", "detail": "Rapid community adoption. LiteParse reaches version 1.3.1 with Python wrapper, Homebrew formula, and agent skill packaging. Repo includes benchmarking code and evaluation datasets on HuggingFace." }
  ],
  "pricing": [
    { "product": "LiteParse", "free": "Fully free, open-source (Apache-2.0)", "paid": "N/A" },
    { "product": "LlamaParse (cloud alternative)", "free": "Free tier available", "paid": "Paid cloud service by LlamaIndex" }
  ],
  "code_examples": [
    {
      "title": "Install and parse from the CLI",
      "language": "bash",
      "code": "npm i -g @llamaindex/liteparse\nlit parse your-document.pdf"
    },
    {
      "title": "Programmatic usage in TypeScript",
      "language": "typescript",
      "code": "import { LiteParse } from '@llamaindex/liteparse';\n\nconst parser = new LiteParse({ ocrEnabled: true });\nconst result = await parser.parse('document.pdf');\nconsole.log(result.text);"
    },
    {
      "title": "Screenshot specific pages",
      "language": "bash",
      "code": "lit screenshot document.pdf --target-pages \"1,3,5\""
    }
  ],
  "resources": {
    "official": [
      { "title": "GitHub Repository", "url": "https://github.com/run-llama/liteparse" },
      { "title": "Documentation", "url": "https://developers.llamaindex.ai/liteparse/" },
      { "title": "Launch Blog Post", "url": "https://www.llamaindex.ai/blog/liteparse-local-document-parsing-for-ai-agents" },
      { "title": "npm Package", "url": "https://www.npmjs.com/package/@llamaindex/liteparse" }
    ],
    "sources": [
      { "title": "LlamaIndex Blog — LiteParse Launch", "url": "https://www.llamaindex.ai/blog/liteparse-local-document-parsing-for-ai-agents" },
      { "title": "MarkTechPost Coverage", "url": "https://www.marktechpost.com/2026/03/19/llamaindex-releases-liteparse-a-cli-and-typescript-native-library-for-spatial-pdf-parsing-in-ai-agent-workflows/" }
    ]
  }
}
