{
  "$schema": "https://raw.githubusercontent.com/imbilawork/know.agent/main/agentapi/schema/explainer-v1.json",
  "meta": {
    "id": "openclaw-teams",
    "title": "OpenClaw x Microsoft Teams Explained",
    "subtitle": "Your AI agent inside Microsoft Teams — DMs, channels, and Adaptive Cards",
    "topic": "OpenClaw Microsoft Teams Integration",
    "category": "ai-agent-integration",
    "tags": ["microsoft-teams", "ai-agent", "bot-framework", "adaptive-cards", "mcp", "self-hosted", "openclaw"],
    "published": "2026-03",
    "validated": "2026-03",
    "author": "Imbila.AI",
    "canonical_url": "https://know.imbila.ai/openclaw-teams-explainer",
    "license": "CC-BY-SA-4.0"
  },
  "summary": "The OpenClaw Microsoft Teams integration is a plugin that connects a self-hosted AI agent to Microsoft Teams via the Azure Bot Framework. It handles personal DMs, group chats, and channel conversations — routing messages through a webhook gateway on port 3978. As of January 2026, Teams ships as a standalone plugin (@openclaw/msteams) rather than a core dependency, supporting Adaptive Cards v1.5, SharePoint file uploads, and Composio MCP for Graph API operations.",
  "key_stats": [
    { "value": "23", "label": "Supported Channels" },
    { "value": "3978", "label": "Default Webhook Port" },
    { "value": "v1.5", "label": "Adaptive Card Schema" },
    { "value": "$0", "label": "OpenClaw License Cost" }
  ],
  "products": [
    {
      "name": "Microsoft Teams Plugin",
      "role": "Channel layer",
      "description": "Handles Bot Framework webhooks, Adaptive Cards, file sharing via SharePoint, and per-channel configuration overrides. Installed separately since January 2026 via `openclaw plugins install @openclaw/msteams`.",
      "pricing": { "free": "Open-source, free", "paid": "LLM API token costs only" }
    },
    {
      "name": "Composio MCP Connector",
      "role": "MCP integration for Teams actions",
      "description": "Connects via the Composio MCP server to enable granular Teams actions — scheduling meetings, archiving teams, managing memberships — from natural language commands.",
      "pricing": null
    },
    {
      "name": "Azure AD + RSC",
      "role": "Auth layer",
      "description": "JWT validation on inbound webhooks, App ID + Password for outbound calls. Resource-Specific Consent (RSC) for real-time channel listening without broad admin scopes.",
      "pricing": null
    }
  ],
  "ecosystem": {
    "channel": {
      "product": "Microsoft Teams Plugin (@openclaw/msteams)",
      "description": "Handles Bot Framework webhooks, Adaptive Cards, file sharing via SharePoint, and per-channel configuration overrides."
    },
    "mcp": {
      "product": "Composio MCP Connector",
      "description": "Connects via the Composio MCP server to enable granular Teams actions — scheduling meetings, archiving teams, managing memberships — from natural language commands."
    },
    "auth": {
      "product": "Azure AD + RSC",
      "description": "JWT validation on inbound webhooks, App ID + Password for outbound calls. Resource-Specific Consent (RSC) for real-time channel listening without broad admin scopes."
    }
  },
  "decision_guide": {
    "use_when": [
      "You need a self-hosted AI assistant that your org controls — model choice, data residency, prompt engineering, the lot.",
      "Your team already lives in Teams and you want AI embedded in existing workflows, not bolted on.",
      "You want to avoid Copilot's $30/user/month pricing and need a more flexible, multi-model approach.",
      "You have (or can get) Azure AD admin consent for the required permissions and someone who can maintain the gateway."
    ],
    "skip_when": [
      "Your org blocks third-party bots in Teams or has a strict no-custom-app policy. Check with IT first.",
      "You don't have access to Azure Portal to create a Bot registration — this is a hard requirement.",
      "You need full message history search and recall. RSC only covers live events; Graph API with admin consent is needed for historical access.",
      "You want zero maintenance. This requires a running gateway on a publicly accessible HTTPS endpoint. If that sounds like a burden, Copilot might be simpler."
    ]
  },
  "use_cases": [
    {
      "category": "DevOps",
      "title": "Deployment Notifications",
      "description": "Adaptive Cards with build status, rollback buttons, and log links posted to a #deployments channel. One-click rollback from inside Teams."
    },
    {
      "category": "IT Support",
      "title": "Helpdesk Triage",
      "description": "Employees DM the bot with issues. OpenClaw classifies, routes to the right queue, and auto-creates tickets — without a separate helpdesk portal."
    },
    {
      "category": "HR",
      "title": "Onboarding Assistant",
      "description": "New hires get a personal DM bot that walks them through policy docs, benefits enrolment, and team introductions — answering questions in natural language."
    },
    {
      "category": "Sales",
      "title": "CRM Query Bot",
      "description": "Via MCP connectors, sales reps ask the bot for deal status, contact history, or pipeline numbers directly in their Teams channel — no tab-switching to Salesforce."
    },
    {
      "category": "Engineering",
      "title": "Daily Standup Polls",
      "description": "Automated Adaptive Card polls at 9am. Votes collected automatically. Summary posted at end-of-day. No meeting required for status updates."
    },
    {
      "category": "Compliance",
      "title": "Policy Q&A",
      "description": "Trained on internal policy documents with RAG. Employees ask compliance questions in Teams and get source-attributed answers — audit-friendly."
    }
  ],
  "timeline": [
    { "date": "2024", "title": "Teams Bundled in Core", "detail": "Early versions included Microsoft Teams as a built-in channel alongside WhatsApp, Telegram, and Discord. Configuration was simpler but the core install was heavier." },
    { "date": "2025-07", "title": "Multi-Tenant Deprecation", "detail": "Microsoft deprecated new multi-tenant bot registrations (July 2025). OpenClaw recommended single-tenant bots for all new deployments." },
    { "date": "2026-01", "title": "Breaking Change: Plugin Extraction", "detail": "Teams moved out of core into @openclaw/msteams. Separately installable, independently versioned. Release 2026.1.15." },
    { "date": "2026-02", "title": "OpenClaw v2026.2+ & Composio MCP", "detail": "Full Adaptive Card v1.5 support, SharePoint file integration, Composio MCP toolchain for Graph API operations, and expanded private channel support rolling out." }
  ],
  "pricing": [
    { "product": "OpenClaw", "free": "Open-source, free", "paid": "N/A" },
    { "product": "Azure Bot Framework", "free": "Free tier sufficient for most use cases", "paid": "Standard channels pricing for high volume" },
    { "product": "LLM API Tokens", "free": "Varies by provider", "paid": "$6-$50/month for small teams; higher for enterprise" }
  ],
  "code_examples": [
    {
      "title": "Install the Teams plugin",
      "language": "bash",
      "code": "openclaw plugins install @openclaw/msteams"
    },
    {
      "title": "Configure Teams credentials in openclaw.json",
      "language": "json",
      "code": "{\n  \"channels\": {\n    \"msteams\": {\n      \"enabled\": true,\n      \"appId\": \"APP_ID\",\n      \"appPassword\": \"SECRET\",\n      \"tenantId\": \"TENANT_ID\"\n    }\n  }\n}"
    }
  ],
  "resources": {
    "official": [
      { "title": "OpenClaw Teams Docs", "url": "https://docs.openclaw.ai/channels/msteams" },
      { "title": "Microsoft Teams Platform Docs", "url": "https://learn.microsoft.com/en-us/microsoftteams/platform/" },
      { "title": "Adaptive Cards Designer", "url": "https://adaptivecards.io/designer/" },
      { "title": "Composio MCP Integration", "url": "https://composio.dev/toolkits/microsoft_teams/framework/openclaw" },
      { "title": "OpenClaw GitHub", "url": "https://github.com/openclaw" },
      { "title": "OpenClaw Discord", "url": "https://discord.gg/openclaw" },
      { "title": "Setup & Integration Guide", "url": "https://open-claw.me/channels/teams" }
    ],
    "sources": [
      { "title": "OpenClaw Docs — Microsoft Teams Channel", "url": "https://docs.openclaw.ai/channels/msteams" },
      { "title": "OpenClaw Teams Setup Guide", "url": "https://open-claw.me/channels/teams" },
      { "title": "Composio — OpenClaw Teams MCP", "url": "https://composio.dev/toolkits/microsoft_teams/framework/openclaw" },
      { "title": "OpenClaw AI — Teams Integration", "url": "https://openclaw-ai.com/en/channels/teams" }
    ]
  }
}
